review_id,draft_sku,proposed_name,quality_flags,question,primary_url
folder14-012,ADG-001803,Chiński tasak ze stali nierdzewnej z metalową rękojeścią,probable_duplicate_of_ADG-001811,Zdjęcia pokazują ten sam wzór ostrza etykiety i rękojeści co ADG-001811,https://img.zira.pl/asiandeligo/owner-images/folder14/ADG-001803/01-PETE8063.JPG
folder14-020,ADG-001811,Chiński tasak ze stali nierdzewnej z metalową rękojeścią,probable_duplicate_of_ADG-001803,Scalić z ADG-001803 po potwierdzeniu właściciela,https://img.zira.pl/asiandeligo/owner-images/folder14/ADG-001811/01-PETE8104.JPG
folder14-028,ADG-001817,Potrójny zawór gazowy do palnika,non_retail_or_service_part,Wygląda na część instalacyjną lub wyposażenie sklepu; potwierdzić czy jest sprzedawana,https://img.zira.pl/asiandeligo/owner-images/folder14/ADG-001817/01-PETE8116.JPG
folder14-044,ADG-001832,Przezroczysta plastikowa pokrywka do pojemnika,missing_size_and_container_match,Bez rozmiaru lub dopasowanego pojemnika produkt nie jest bezpieczny do publikacji,https://img.zira.pl/asiandeligo/owner-images/folder14/ADG-001832/01-PETE8161.JPG
folder14-050,ADG-001837,Papierowa torba zakupowa Asia Foods,store_packaging_or_retail_product,Potwierdzić czy torba jest sprzedawana klientom czy służy jako opakowanie sklepu,https://img.zira.pl/asiandeligo/owner-images/folder14/ADG-001837/01-PETE8173.JPG
folder14-054,ADG-001841,Kuchenka gazowa stołowa Sonarema Fondex,gas_appliance_compliance_and_model_pending,Nie publikować bez potwierdzenia modelu zgodności stanu i gwarancji,https://img.zira.pl/asiandeligo/owner-images/folder14/ADG-001841/01-PETE8182.JPG
