id,slug,name,category,firstSku,missingFields,countryOfOrigin,unitOfMeasure,pricePerUnit
747d2d7b-4ec6-4ee5-aad9-e58d86bcb1d1,KIMCHI-4943,"Duża japońska miska do ramenu ryby Koi 21,5 x 8 cm - Emro",komplety-do-sushi-i-herbaty,KIMCHI-4943,ingredients|allergens|nutritionFacts|storageZone|unitPrice,Japonia,,
83a6fbe5-3152-4a0c-9a89-8a1c00decfd5,KIMCHI-3396,"Edomae Inari Age, smażone kieszonki tofu (24 szt.) 540g - Nishimoto",tofu,KIMCHI-3396,allergens|nutritionFacts|storageZone|unitPrice,Japonia,,
b8a9b1f8-0739-4ad2-bc62-cdc82acb3507,KIMCHI-871,"Edomae Inari Age, smażone kieszonki tofu do sushi 240g - Yamato",tofu,KIMCHI-871,allergens|nutritionFacts|storageZone|unitPrice,Japonia,,
9be44b90-283d-45d4-aa2e-b2c116556e38,KIMCHI-5369,"Edomae Inari Age, smażone kieszonki tofu do sushi 5x8cm 16szt 250g - Misuzu",tofu,KIMCHI-5369,allergens|nutritionFacts|storageZone|unitPrice,Japonia,,
ef58d297-33b1-40a0-9df8-f77ebb50e73c,KIMCHI-5472,"Fasola edamame, ziarna soi w zalewie 400g - House of Asia",owoce-marynowane-warzywa,KIMCHI-5472,allergens|nutritionFacts|storageZone|unitPrice,Chiny,,
1d17d3b0-e34a-41b5-ba6f-4ff2d1a2d092,KIMCHI-3762,"Fasola edamame, ziarna soi w zalewie 400g - ITA-SAN",owoce-marynowane-warzywa,KIMCHI-3762,allergens|nutritionFacts|storageZone|unitPrice,Chiny,,
04a0a0bf-af86-4de9-a8fb-d29140bbdc46,KIMCHI-2227,Fasolka edamame z wasabi 140g - Golden Turtle Brand,słodycze-przekąski,KIMCHI-2227,allergens|nutritionFacts|storageZone|unitPrice,Chiny,,
db8b73ac-0993-4a82-8d0f-293d3eb743f7,KIMCHI-5719,Fermentowana czarna fasola sojowa (Douchi) 250g - Pearl River Bridge,marynowane-warzywa-i-owoce,KIMCHI-5719,allergens|nutritionFacts|storageZone|unitPrice,Chiny,,
981fc95c-4f7d-4109-a85b-3a660ef90156,KIMCHI-840,Fermentowana czarna soja w oleju chili 280g - Lao Gan Ma,sosy-marynaty-oleje,KIMCHI-840,allergens|nutritionFacts|storageZone|unitPrice,Chiny,,
aad13bc6-b94f-426f-9bdc-eb47ae6b7cb7,KIMCHI-4546,Fermentowane tofu (hong furu) w czerwonym różanym sosie 340g - Wangzhihe,sosy-marynaty,KIMCHI-4546,allergens|nutritionFacts|storageZone|unitPrice,Chiny,,
66022925-7be2-4bff-9d22-01e86825fad9,KIMCHI-5589,Fermentowany sos rybny Bagoon Balayan 310ml - Monika,sosy-marynaty,KIMCHI-5589,allergens|nutritionFacts|storageZone|unitPrice,Filipiny,,
035996ea-ee72-43d2-9e78-33de6b9f01fb,KIMCHI-4203,Filety Anchois 75g - Mari Del Sus,dania-gotowe,KIMCHI-4203,allergens|nutritionFacts|storageZone|unitPrice,Włochy,,
a96805f4-c9f7-4b6d-aa06-1ca96fdb0ede,KIMCHI-5582,Filipiński makaron pszenny z kurkumą Pancit Canton 227g - Monika,makaron-pszenny,KIMCHI-5582,allergens|nutritionFacts|storageZone|unitPrice,Filipiny,,
0a93f13f-465a-4de3-9477-bcbb62df2602,KIMCHI-4422,Fish Snack BBQ przekąska rybna barbecue 52g - Taro,dania-gotowe,KIMCHI-4422,allergens|nutritionFacts|storageZone|unitPrice,Tajlandia,,
d2b223f8-8e6a-4d02-9a30-34f662fbd98b,KIMCHI-4421,Fish Snack Hot przekąska rybna pikantna 52g - Taro,dania-gotowe,KIMCHI-4421,allergens|nutritionFacts|storageZone|unitPrice,Tajlandia,,
7edee6d3-7634-4cd5-9ddd-47cd19a8b72e,KIMCHI-4420,Fish Snack Original przekąska rybna 52g - Taro,dania-gotowe,KIMCHI-4420,allergens|nutritionFacts|storageZone|unitPrice,Tajlandia,,
d34271cd-63ef-4021-9eca-16eb3383ed64,KIMCHI-1105,Foremka do futomaki sushi - duża rolka,foremki,KIMCHI-1105,ingredients|allergens|nutritionFacts|storageZone|unitPrice,Chiny,,
2e2c9c88-861f-4d62-a331-1a63ce196698,KIMCHI-1071,Foremka do maki sushi - mała rolka,foremki,KIMCHI-1071,ingredients|allergens|nutritionFacts|storageZone|unitPrice,Chiny,,
20b9375a-7b2e-4974-b31a-2697de57551e,KIMCHI-1070,Foremka do nigiri sushi na 5 szt.,foremki,KIMCHI-1070,ingredients|allergens|nutritionFacts|storageZone|unitPrice,Chiny,,
ea96d761-baf6-4242-94a5-78469ec42c49,KIMCHI-5440,Freesia Blooming Perfumed Hand Cream 30ml - nawilżający krem do rąk o zapachu frezji - Holika Holika,koreańskie-kosmetyki,KIMCHI-5440,allergens|nutritionFacts|storageZone|unitPrice,Korea Południowa,,
10015944-7454-452d-a775-e90c1399e691,KIMCHI-4037,"Fruit Juice Gummy Grape 100%, żelki o smaku winogronowym 54g - Meiji",słodycze-przekąski,KIMCHI-4037,allergens|nutritionFacts|storageZone|unitPrice,Korea Południowa,,
6d4166d4-7acf-44ce-9a15-fea7025137ef,KIMCHI-4432,"Fruit Juice Gummy Muscat 100%, żelki o smaku białych winogron 54g - Meiji",słodycze-przekąski,KIMCHI-4432,allergens|nutritionFacts|storageZone|unitPrice,Japonia,,
b23798e6-af8b-4a15-bb08-c435ce625d94,KIMCHI-3791,"Frutia Grape Gummy, żelki o smaku winogronowym 107g - Kasugai",słodycze-przekąski,KIMCHI-3791,allergens|nutritionFacts|storageZone|unitPrice,Japonia,,
8026dffd-bde1-4fa7-a6be-d68a401d804c,KIMCHI-4375,"Frutia Kiwi Gummy, żelki o smaku kiwi 107g - Kasugai",słodycze-przekąski,KIMCHI-4375,allergens|nutritionFacts|storageZone|unitPrice,Japonia,,
025c58c6-a693-4540-b7b0-4503412e41ad,KIMCHI-4419,"Frutia Lychee Gummy, żelki o smaku liczi 102g - Kasugai",słodycze-przekąski,KIMCHI-4419,allergens|nutritionFacts|storageZone|unitPrice,Japonia,,
f263e7e6-1820-4822-9baf-0bb44d628689,KIMCHI-5110,"Frutia Mango Gummy, żelki o smaku mango 102g - Kasugai",słodycze-przekąski,KIMCHI-5110,allergens|nutritionFacts|storageZone|unitPrice,Japonia,,
520854de-a750-4308-8306-4c3fa46b5d3b,KIMCHI-3792,"Frutia Muscat Gummy, żelki o smaku winogron Muscat 107g - Kasugai",słodycze-przekąski,KIMCHI-3792,allergens|nutritionFacts|storageZone|unitPrice,Japonia,,
47fedb34-7fb2-4c5b-93c3-d4deab6d29c1,KIMCHI-3790,"Frutia Peach Gummy, żelki o smaku brzoskwiniowym 107g - Kasugai",słodycze-przekąski,KIMCHI-3790,allergens|nutritionFacts|storageZone|unitPrice,Japonia,,
597b103d-214c-4dc5-90bf-6fc8f398ebc4,KIMCHI-4376,"Frutia Strawberry Gummy, żelki o smaku truskawkowym 102g - Kasugai",słodycze-przekąski,KIMCHI-4376,allergens|nutritionFacts|storageZone|unitPrice,Japonia,,
17bee644-0384-4880-ae3f-36ccf25ad6eb,KIMCHI-4426,"Frutia Watermelon Gummy, żelki o smaku arbuzowym 107g - Kasugai",słodycze-przekąski,KIMCHI-4426,allergens|nutritionFacts|storageZone|unitPrice,Japonia,,
a6f0e055-8af6-47eb-91b1-3e3530f6f21d,KIMCHI-3793,"Frutia Yuzu Gummy, żelki o smaku cytrusowym 102g - Kasugai",słodycze-przekąski,KIMCHI-3793,allergens|nutritionFacts|storageZone|unitPrice,Japonia,,
c7111732-73e3-4b98-9f5f-adecd9b58358,KIMCHI-4528,"Fukamushicha Sencha, głęboko parowana zielona herbata liściasta 50g - Maruka",herbaty,KIMCHI-4528,allergens|nutritionFacts|storageZone|unitPrice,Japonia,,
d45d4455-6d95-4114-8955-926add661b11,KIMCHI-3997,"Furikake Aji Douraku, posypka do ryżu wzbogacana 25g - Marumiya",przyprawy,KIMCHI-3997,allergens|nutritionFacts|storageZone|unitPrice,Japonia,,
6798460b-9725-45f1-9841-f8f4bebe3278,KIMCHI-4003,"Furikake Mazekomi Fragrant Sesame Oil Wakame, posypka do ryżu z wakame i olejem sezamowym 29g - Marumiya",przyprawy,KIMCHI-4003,allergens|nutritionFacts|storageZone|unitPrice,Japonia,,
a39e1486-b252-4b89-919d-309404598749,KIMCHI-4004,"Furikake Mazekomi Wakame Shiso Kombu, posypka do ryżu z wodorostami i liśćmi sezamu (pachnotki) 29g - Marumiya",przyprawy,KIMCHI-4004,allergens|nutritionFacts|storageZone|unitPrice,Japonia,,
aa071903-a935-4faa-8234-608afd7b8a48,KIMCHI-3999,"Furikake Noritama, posypka do ryżu wzbogacana 25g - Marumiya",przyprawy,KIMCHI-3999,allergens|nutritionFacts|storageZone|unitPrice,Japonia,,
d4900d43-1827-4353-942e-a44c0c2da3e0,KIMCHI-3996,"Furikake Nori Wasabi, posypka do ryżu wzbogacana 20g - Marumiya",przyprawy,KIMCHI-3996,allergens|nutritionFacts|storageZone|unitPrice,Japonia,,
ca8b4077-b1c9-44e9-88d9-4d6090fdb818,KIMCHI-3995,"Furikake Pepatama, posypka do ryżu wzbogacana 20g - Marumiya",przyprawy,KIMCHI-3995,allergens|nutritionFacts|storageZone|unitPrice,Japonia,,
e9fd34f5-97ee-416f-9824-759112281385,KIMCHI-3994,"Furikake Pokemon, posypka do ryżu w 4 smakach 20 x 2,5g - Marumiya",przyprawy,KIMCHI-3994,allergens|nutritionFacts|storageZone|unitPrice,Japonia,,
fdf28bba-8b3a-49b0-a0d8-c750ce228179,KIMCHI-4341,Furikake Pokemon w pojemniku Pikachu 20g - Marumiya,przyprawy,KIMCHI-4341,allergens|nutritionFacts|storageZone|unitPrice,Japonia,,
ffeae7b9-5ac1-4803-974f-bd4f0ba6c2d9,KIMCHI-5482,"Furikake, posypka do ryżu i dań płatki Perilli 20g - Mishima",przyprawy,KIMCHI-5482,allergens|nutritionFacts|storageZone|unitPrice,Japonia,,
06acb37f-746f-43d4-b5d8-da37fb140041,KIMCHI-4699,"Furikake Sukiyaki, posypka do ryżu 34g - Marumiya",przyprawy,KIMCHI-4699,allergens|nutritionFacts|storageZone|unitPrice,Japonia,,
c27a7286-6cf9-4269-860f-5cde210cec42,KIMCHI-3998,"Furikake Tarako, posypka do ryżu wzbogacana 25g - Marumiya",przyprawy,KIMCHI-3998,allergens|nutritionFacts|storageZone|unitPrice,Japonia,,
a7afb846-034f-4204-87e6-f33846105833,KIMCHI-269,Galangal w proszku 100g Cock Brand,przyprawy,KIMCHI-269,allergens|nutritionFacts|storageZone|unitPrice,Tajlandia,,
4da56e11-a287-4c6b-83ea-2a7fb945c29b,KIMCHI-3134,"Garlic Tteokbokki, kluski ryżowe w sosie czosnkowo-paprykowym 260g - O'Food",dania-gotowe,KIMCHI-3134,allergens|nutritionFacts|storageZone|unitPrice,Korea Południowa,,
0455a26b-69f0-4805-af8a-465dc5a24aa2,KIMCHI-4944,"Garnek gliniany bao zai (Bo Chai), miska do gotowania z pokrywką śr. 18 cm - Jin Hua Li Ci",miski,KIMCHI-4944,ingredients|allergens|nutritionFacts|storageZone|unitPrice,Chiny,,
ece19366-8b91-45f4-ad7c-635a0d28893b,KIMCHI-756,Glony Dasima (kombu) suszone 56g - Assi Brand,kombu-dasima,KIMCHI-756,allergens|nutritionFacts|storageZone|unitPrice,Korea Południowa,,
8fca21b8-f8b4-4f3d-9145-94286bea5193,KIMCHI-2648,Glony do sushi Yaki Nori GOLD 10 szt. - KC,arkusze-nori-gim,KIMCHI-2648,allergens|nutritionFacts|storageZone|unitPrice,Korea Południowa,,
0526158d-78a8-42d8-8967-79c48996af93,KIMCHI-2649,Glony do sushi Yaki Nori GOLD 3 x 10 szt. - KC,arkusze-nori-gim,KIMCHI-2649,allergens|nutritionFacts|storageZone|unitPrice,Korea Południowa,,
